{
  "$schema": "https://json-schema.org/draft/2020-12/schema",
  "$id": "https://andreabozzo.dev/schema/writing.schema.json",
  "title": "WritingIndexV1",
  "type": "object",
  "additionalProperties": false,
  "required": ["$schemaVersion", "generatedAt", "source", "items"],
  "properties": {
    "$schemaVersion": {
      "const": "v1"
    },
    "generatedAt": {
      "type": "string",
      "format": "date-time"
    },
    "source": {
      "type": "string",
      "minLength": 1
    },
    "items": {
      "type": "array",
      "items": {
        "$ref": "#/$defs/WritingItemV1"
      }
    }
  },
  "$defs": {
    "WritingItemV1": {
      "type": "object",
      "additionalProperties": false,
      "required": [
        "id",
        "slug",
        "language",
        "title",
        "summary",
        "publishedAt",
        "url",
        "sourcePath",
        "tags",
        "categories",
        "wordCount",
        "readingMinutes"
      ],
      "properties": {
        "id": {
          "type": "string",
          "minLength": 1
        },
        "slug": {
          "type": "string",
          "minLength": 1
        },
        "language": {
          "type": "string",
          "minLength": 2
        },
        "title": {
          "type": "string",
          "minLength": 1
        },
        "summary": {
          "type": "string",
          "minLength": 1
        },
        "description": {
          "type": "string"
        },
        "publishedAt": {
          "type": "string",
          "format": "date-time"
        },
        "url": {
          "type": "string",
          "minLength": 1
        },
        "sourcePath": {
          "type": "string",
          "minLength": 1
        },
        "tags": {
          "type": "array",
          "items": {
            "type": "string"
          }
        },
        "categories": {
          "type": "array",
          "items": {
            "type": "string"
          }
        },
        "relatedCaseStudies": {
          "type": "array",
          "items": {
            "type": "string"
          }
        },
        "wordCount": {
          "type": "integer",
          "minimum": 0
        },
        "readingMinutes": {
          "type": "integer",
          "minimum": 0
        }
      }
    }
  }
}
