{
  "$schemaVersion": "v1",
  "generatedAt": "2026-09-13T04:33:13Z",
  "source": "blog/content/posts",
  "items": [
    {
      "id": "commit-barrier-iceberg-blog:en",
      "slug": "commit-barrier-iceberg-blog",
      "language": "en",
      "title": "I tried to put data quality inside the commit. One pub(crate) stopped it.",
      "summary": "A falsification experiment with a written kill list and a negative result. Delta has a purpose-built idempotent commit; iceberg-rust rebases a transaction onto a base the caller never checked, so an external writer cannot make a commit conditional. The green concurrency test was a false pass — 0 of 40 rounds ever raced — and only a failpoint showed the duplicate.",
      "description": "A profiler tells you the data is bad after it is already durable. So I tried to make the passing report a precondition of durability, on both Delta and Iceberg, with one trait. Delta worked. Iceberg could not express the commit at all — and the reason is four lines of visibility in a library, not anything in the spec.",
      "publishedAt": "2026-09-04T08:00:00Z",
      "url": "./blog/en/posts/commit-barrier-iceberg-blog/",
      "sourcePath": "blog/content/posts/commit-barrier-iceberg-blog.en.md",
      "tags": [
        "Rust",
        "Apache Iceberg",
        "Delta Lake",
        "Data Quality",
        "Lakehouse",
        "Transactions",
        "Open Source",
        "Data Engineering"
      ],
      "categories": [
        "Data Engineering",
        "Open Source"
      ],
      "wordCount": 2350,
      "readingMinutes": 11
    },
    {
      "id": "commit-barrier-iceberg-blog:it",
      "slug": "commit-barrier-iceberg-blog",
      "language": "it",
      "title": "Ho provato a mettere la data quality dentro il commit. Mi ha fermato un pub(crate).",
      "summary": "Un esperimento di falsificazione con una kill list scritta prima e un risultato negativo. Delta ha un commit idempotente fatto apposta; iceberg-rust ribasa la transazione su una base che il chiamante non ha mai controllato, quindi uno scrittore esterno non può rendere condizionale un commit. Il test di concorrenza verde era un falso positivo — 0 round su 40 hanno davvero gareggiato — e solo un failpoint ha fatto uscire il duplicato.",
      "description": "Un profiler ti dice che i dati sono sbagliati quando sono già durevoli. Così ho provato a rendere il report che passa una precondizione della durabilità, su Delta e su Iceberg, con un solo trait. Delta ha funzionato. Iceberg non riesce proprio a esprimere quel commit — e il motivo sono quattro righe di visibilità in una libreria, non qualcosa nella specifica.",
      "publishedAt": "2026-09-04T08:00:00Z",
      "url": "./blog/posts/commit-barrier-iceberg-blog/",
      "sourcePath": "blog/content/posts/commit-barrier-iceberg-blog.it.md",
      "tags": [
        "Rust",
        "Apache Iceberg",
        "Delta Lake",
        "Data Quality",
        "Lakehouse",
        "Transactions",
        "Open Source",
        "Data Engineering"
      ],
      "categories": [
        "Data Engineering",
        "Open Source"
      ],
      "wordCount": 2376,
      "readingMinutes": 11
    },
    {
      "id": "fantabuddy-blog:en",
      "slug": "fantabuddy-blog",
      "language": "en",
      "title": "I Built a Model for Fantacalcio. The Useful Part Is When It Says No.",
      "summary": "I started with Milan in Championship Manager 03/04, went through an almost perfect auction and a season shaped by injuries, then built Fantabuddy on holiday: a system that turns player lists, history and APIs into an auditable auction report.",
      "description": "From Championship Manager 03/04 to Fantabuddy: how twenty years of football obsession became a reproducible auction report, with fresh data, models allowed to lose, and decisions that remain human.",
      "publishedAt": "2026-08-20T08:00:00Z",
      "url": "./blog/en/posts/fantabuddy-blog/",
      "sourcePath": "blog/content/posts/fantabuddy-blog.en.md",
      "tags": [
        "Fantacalcio",
        "Python",
        "DuckDB",
        "Machine Learning",
        "Data Engineering",
        "Open Source",
        "Football Manager"
      ],
      "categories": [
        "Data Engineering",
        "Open Source"
      ],
      "wordCount": 1817,
      "readingMinutes": 9
    },
    {
      "id": "fantabuddy-blog:it",
      "slug": "fantabuddy-blog",
      "language": "it",
      "title": "Ho costruito un modello per il Fantacalcio. La parte utile è quando dice di no.",
      "summary": "Sono partito dal Milan di Scudetto 03/04, sono passato per un'asta quasi perfetta e una stagione decisa dagli infortuni, e in vacanza ho costruito Fantabuddy: un sistema che trasforma listoni, storico e API in un report d'asta verificabile.",
      "description": "Da Scudetto 03/04 a Fantabuddy: come vent'anni di passione per il calcio sono diventati un report d'asta riproducibile, con dati aggiornati, modelli autorizzati a perdere e decisioni ancora umane.",
      "publishedAt": "2026-08-20T08:00:00Z",
      "url": "./blog/posts/fantabuddy-blog/",
      "sourcePath": "blog/content/posts/fantabuddy-blog.it.md",
      "tags": [
        "Fantacalcio",
        "Python",
        "DuckDB",
        "Machine Learning",
        "Data Engineering",
        "Open Source",
        "Football Manager"
      ],
      "categories": [
        "Data Engineering",
        "Open Source"
      ],
      "wordCount": 1786,
      "readingMinutes": 9
    },
    {
      "id": "dbt-fusion-rust-blog:en",
      "slug": "dbt-fusion-rust-blog",
      "language": "en",
      "title": "dbt rewrote itself in Rust. The speed is the boring part.",
      "summary": "I opened a bug report against dbt and found a codebase nobody had told me about: 77 Rust crates where the Python used to be. This is what the rewrite is actually for, why the marketing undersells it, and what I broke loose while poking at it — two fixes, both for bugs that never printed an error.",
      "description": "dbt Core's main branch has no Python engine left in it. 77 Rust crates, 18 stray .py files, no runtime. Everyone is talking about parse times. Parse times are the least interesting thing that happened.",
      "publishedAt": "2026-08-04T08:00:00Z",
      "url": "./blog/en/posts/dbt-fusion-rust-blog/",
      "sourcePath": "blog/content/posts/dbt-fusion-rust-blog.en.md",
      "tags": [
        "dbt",
        "Rust",
        "DuckDB",
        "Apache Arrow",
        "DataFusion",
        "Iceberg",
        "Open Source",
        "Data Engineering"
      ],
      "categories": [
        "Data Engineering",
        "Open Source"
      ],
      "wordCount": 2956,
      "readingMinutes": 14
    },
    {
      "id": "dbt-fusion-rust-blog:it",
      "slug": "dbt-fusion-rust-blog",
      "language": "it",
      "title": "dbt si è riscritto in Rust. La velocità è la parte noiosa.",
      "summary": "Ho aperto una segnalazione di bug su dbt e ho trovato una codebase di cui nessuno mi aveva parlato: 77 crate Rust dove prima c'era il Python. Questo è a cosa serve davvero la riscrittura, perché il marketing la sottovende, e cosa ho smosso frugandoci dentro — due fix, entrambi per bug che non hanno mai stampato un errore.",
      "description": "Sul branch main di dbt Core non è rimasto nemmeno un motore Python. 77 crate Rust, 18 file .py sparsi, nessun runtime. Tutti parlano dei tempi di parsing. I tempi di parsing sono la cosa meno interessante che è successa.",
      "publishedAt": "2026-08-04T08:00:00Z",
      "url": "./blog/posts/dbt-fusion-rust-blog/",
      "sourcePath": "blog/content/posts/dbt-fusion-rust-blog.it.md",
      "tags": [
        "dbt",
        "Rust",
        "DuckDB",
        "Apache Arrow",
        "DataFusion",
        "Iceberg",
        "Open Source",
        "Data Engineering"
      ],
      "categories": [
        "Data Engineering",
        "Open Source"
      ],
      "wordCount": 3114,
      "readingMinutes": 15
    },
    {
      "id": "nephtys-edge-power-blog:en",
      "slug": "nephtys-edge-power-blog",
      "language": "en",
      "title": "Nephtys on a Raspberry Pi: 6.6× less memory, exactly the same watts",
      "summary": "I had never publicly written about Nephtys, and the first thing I have to report about it on real hardware is a null result: the memory advantage reproduced on a Raspberry Pi 5, the energy advantage never existed.",
      "description": "A peer reviewer asked whether my edge connector actually runs on edge hardware. It does, using 6.59× less memory than Node-RED — and drawing exactly the same power. Why the second half of that sentence is the useful one.",
      "publishedAt": "2026-07-25T10:00:00Z",
      "url": "./blog/en/posts/nephtys-edge-power-blog/",
      "sourcePath": "blog/content/posts/nephtys-edge-power-blog.en.md",
      "tags": [
        "Edge Computing",
        "Go",
        "NATS",
        "Raspberry Pi",
        "Streaming",
        "Benchmarking",
        "Open Source"
      ],
      "categories": [
        "Data Engineering",
        "Embedded",
        "Open Source"
      ],
      "wordCount": 2215,
      "readingMinutes": 11
    },
    {
      "id": "nephtys-edge-power-blog:it",
      "slug": "nephtys-edge-power-blog",
      "language": "it",
      "title": "Nephtys su un Raspberry Pi: 6.6× meno memoria, esattamente gli stessi watt",
      "summary": "Non avevo mai scritto pubblicamente di Nephtys, e la prima cosa che devo riportare su hardware reale è un risultato nullo: il vantaggio di memoria si è riprodotto su un Raspberry Pi 5, il vantaggio energetico non è mai esistito.",
      "description": "Un revisore ha chiesto se il mio connettore edge girasse davvero su hardware edge. Gira, usando 6.59× meno memoria di Node-RED — e assorbendo esattamente la stessa potenza. Perché la seconda metà di questa frase è quella utile.",
      "publishedAt": "2026-07-25T10:00:00Z",
      "url": "./blog/posts/nephtys-edge-power-blog/",